{
  "version": 1,
  "round": 1,
  "pass": "evidence",
  "agent": "codex-review",
  "reviewed": "codex-paper",
  "recommendation": "MAJOR REVISION",
  "major": [
    {
      "id": "M1",
      "location": "results.tex, para 2",
      "problem": "The diagnostic-accuracy claim for actigraphy is stated without caveats.",
      "why_it_matters": "It is the central claim of the paper.",
      "resolution": "Qualify the claim and cite the contrasting replication.",
      "evidence": [
        {
          "doi": "10.5555/rbd.2019.001",
          "quote": "In contrast to Smith et al., actigraphy alone did not separate RBD from periodic limb movements.",
          "stance": "contrasting",
          "source": "scite_mcp"
        }
      ],
      "changed_from_blind": "strengthened"
    },
    {
      "id": "M2",
      "location": "discussion.tex, para 1",
      "problem": "A cited source (novak2020) has been retracted.",
      "why_it_matters": "The argument for screening rests on it.",
      "resolution": "Replace or remove the citation.",
      "evidence": [
        {
          "doi": "10.5555/rbd.2020.014",
          "quote": "Crossref update-to: retraction (2023)",
          "stance": "neutral",
          "source": "crossref"
        }
      ],
      "changed_from_blind": "new"
    }
  ],
  "minor": [
    {
      "id": "m1",
      "location": "figures.tex",
      "comment": "Figure 2 lacks a y-axis label.",
      "evidence": [],
      "changed_from_blind": "unchanged"
    }
  ],
  "summary": "codex-review on codex-paper: the evidence bundle confirms the blind findings.",
  "scite_status": "ok"
}
