{
  "agent": "codex-paper",
  "reviewed": "claude-paper",
  "recommendation": "MAJOR REVISION",
  "major": [
    {
      "id": "M1",
      "location": "results.tex, para 2",
      "problem": "Accuracy claim has no source comment.",
      "why_it_matters": "Unverifiable central claim.",
      "resolution": "Cite the source or drop the number."
    }
  ],
  "minor": [
    {
      "id": "m1",
      "location": "intro.tex",
      "comment": "Define acronym."
    }
  ],
  "summary": "Solid structure; the central Results claim is unsupported."
}
